{
  "schema_version": "artifact.manifest.v1",
  "run_id": "run_fixture_001",
  "run_mode": "REFERENCE",
  "snapshot_sha256": "1111111111111111111111111111111111111111111111111111111111111111",
  "result_schema_version": "point-result.v1",
  "created_at": "2026-08-16T10:00:00.000+08:00",
  "items": [
    {"name": "run_manifest.json", "media_type": "application/json", "size_bytes": 10, "sha256": "aaaaaaaaaaaaaaaaaaaaaaaaaaaaaaaaaaaaaaaaaaaaaaaaaaaaaaaaaaaaaaaa", "required": true},
    {"name": "preprocessing_summary.json", "media_type": "application/json", "size_bytes": 16, "sha256": "bbbbbbbbbbbbbbbbbbbbbbbbbbbbbbbbbbbbbbbbbbbbbbbbbbbbbbbbbbbbbbbb", "required": true},
    {"name": "agent_partition_summary.csv", "media_type": "text/csv", "size_bytes": 17, "sha256": "cccccccccccccccccccccccccccccccccccccccccccccccccccccccccccccccc", "required": true},
    {"name": "feature_schema.json", "media_type": "application/json", "size_bytes": 18, "sha256": "dddddddddddddddddddddddddddddddddddddddddddddddddddddddddddddddd", "required": true},
    {"name": "anchor_summary.json", "media_type": "application/json", "size_bytes": 19, "sha256": "eeeeeeeeeeeeeeeeeeeeeeeeeeeeeeeeeeeeeeeeeeeeeeeeeeeeeeeeeeeeeeee", "required": true},
    {"name": "metrics.csv", "media_type": "text/csv", "size_bytes": 20, "sha256": "ffffffffffffffffffffffffffffffffffffffffffffffffffffffffffffffff", "required": true},
    {"name": "results_agent_1.csv", "media_type": "text/csv", "size_bytes": 11, "sha256": "aaaaaaaaaaaaaaaaaaaaaaaaaaaaaaaaaaaaaaaaaaaaaaaaaaaaaaaaaaaaaaa1", "required": true},
    {"name": "results_agent_2.csv", "media_type": "text/csv", "size_bytes": 12, "sha256": "aaaaaaaaaaaaaaaaaaaaaaaaaaaaaaaaaaaaaaaaaaaaaaaaaaaaaaaaaaaaaaa2", "required": true},
    {"name": "results_agent_3.csv", "media_type": "text/csv", "size_bytes": 13, "sha256": "aaaaaaaaaaaaaaaaaaaaaaaaaaaaaaaaaaaaaaaaaaaaaaaaaaaaaaaaaaaaaaa3", "required": true},
    {"name": "alarms.csv", "media_type": "text/csv", "size_bytes": 14, "sha256": "aaaaaaaaaaaaaaaaaaaaaaaaaaaaaaaaaaaaaaaaaaaaaaaaaaaaaaaaaaaaaaa4", "required": true},
    {"name": "diagnostics.json", "media_type": "application/json", "size_bytes": 15, "sha256": "aaaaaaaaaaaaaaaaaaaaaaaaaaaaaaaaaaaaaaaaaaaaaaaaaaaaaaaaaaaaaaa5", "required": true}
  ]
}
